{
  "session_id": "21a104ac-a541-48dd-9547-7236bded34fb",
  "game_slug": "overrun-blitzkrieg",
  "build_id": "01a104ac-a541-78dd-9547-7236bded34fb",
  "host_public_id": "8MCR-LXFH",
  "host_username": "sen11k",
  "map_id": "western-front",
  "mode_id": "conquest",
  "current_players": 1,
  "max_players": 10,
  "state": "open",
  "joinable": true,
  "friends_only": true,
  "revision": 1,
  "created_at": "2026-10-05T20:45:00Z",
  "updated_at": "2026-10-05T20:45:00Z"
}
